528,ICICIPRULI,2018,4.17,95.44,24.63,0.0,280.81,0.27,301.0,5389.0,11.0,80.0,59.0,0.0,5690.0,,,,,,,,663,38832.0,20.0,37062.0,1771.0,5.0,132.0,44.0,1839.0,12.0,1619.0,11.0,59.0,626.0,5690.0,-5389.0,-1188.0,-887.0,749,1436.0,5138.0,0.0,135245.0,141819.0,404.0,18.0,138537.0,2859.0,141819.0,46,Financials,Life Insurance,2.47,Large Cap,ICICIPRULI,https://mkt.in/static/mkt-icons/nifty100/ICICIPRULI.png,ICICI Prudential Life Insurance Company Ltd,https://in.tradingview.com/chart/qGsydD2w/?symbol=NSE%3AAMBUJACEM.T0,"ICICI Prudential Life Insurance Company Ltd carries on business of providing life insurance, pensions and health insurance products to individuals and groups. The business is conducted in participating, non-participating and unit linked lines of business. These products are distributed through individual agents, corporate agents, banks, brokers, sales force and company's website.[1]

It is promoted by ICICI Bank and Prudential Corporation :-

ICICI Bank (51% stake)[2] - The company is a part of ICICI Bank Ltd which is the 2nd largest private bank in India. It offers a diversified range of products and services to retail, SME and corporate customers.[3]

Prudential Plc (22% stake) - It is a British multinational insurance company based in London, England. It is the largest UK life insurer in Asia with presence in India, China, Cambodia, Indonesia, Laos, Malaysia, Myanmar, Philippines and other Asian countries. It is also present in African subcontinent in Nigeria, Ghana, Togo and other countries.[4]",https://www.iciciprulife.com/,https://www.nseindia.com/get-quotes/equity?symbol=ICICIPRULI,https://www.bseindia.com/stock-share-price/icici-prudential-life-insurance-company-ltd/ICICIPRULI/540133/,10.0,80.0,8.75,8.07,14.674823654977477,-5.108172309071057,,3.5145151327980235,50.795556041324986,23
498,HINDUNILVR,2024,16.61,76.32,20.07,0.03,57.85,0.79,10145.0,5324.0,44.0,216.0,96.0,1484.0,15469.0,258.0,548890.59,587463.38,34.51,11.88,7.52,4.32,630,61896.0,334.0,47237.0,14659.0,24.0,817.0,1216.0,13926.0,26.0,10282.0,44.0,96.0,596.0,15469.0,-5324.0,-10034.0,111.0,718,235.0,50541.0,1651.0,28338.0,80765.0,54027.0,1022.0,4316.0,21400.0,80765.0,43,Consumer Staples,FMCG,1.11,Mid Cap,HINDUNILVR,https://mkt.in/static/mkt-icons/nifty100/HINDUNILVR.png,Hindustan Unilever Ltd,https://in.tradingview.com/chart/?symbol=NSE%3AHINDUNILVR,"Hindustan Unilever is in the FMCG business comprising primarily of Home Care, Beauty & Personal Care and Foods & Refreshment segments. The Company has manufacturing facilities across the country and sells primarily in India.",http://www.hul.co.in/,https://www.nseindia.com/get-quotes/equity?symbol=HINDUNILVR,https://www.bseindia.com/stock-share-price/hindustan-unilever-ltd/HINDUNILVR/500696/,1.0,216.0,27.2,20.2,7.832230713093313,9.369522756745852,10.038781395437567,1.504473837774752,47.17615643250288,24
877,SHREECEM,2013,18.53,28.81,26.12,0.34,9.06,0.88,990.0,270.0,288.0,5787.0,7.0,1288.0,1260.0,,,,,,,,1082,5418.0,3857.0,1561.0,29.0,187.0,193.0,436.0,1119.0,10.0,1004.0,288.0,7.0,1002.0,1260.0,-270.0,-982.0,8.0,1213,35.0,3809.0,1288.0,1028.0,6160.0,1782.0,133.0,2203.0,2042.0,6160.0,79,Materials,Cement,2.86,Large Cap,SHREECEM,https://mkt.in/static/mkt-icons/nifty100/SHREECEM.png,Shree Cement Ltd,https://in.tradingview.com/chart/qGsydD2w/?symbol=NSE%3AAMBUJACEM.T0,Shree Cement is engaged in manufacturing and selling of cement and cement related products and is ** one of the lowest cost producers in the country. It is the 3rd largest** cement,https://www.shreecement.com/,https://www.nseindia.com/get-quotes/equity?symbol=SHREECEM,https://www.bseindia.com/stock-share-price/shree-cement-ltd/SHREECEM/500387/,10.0,5787.0,14.8,12.2,14.24467116762238,5.6103507499905225,6.898030378675513,1.254980079681275,45.90510962872849,25
309,DABUR,2022,16.0,20.68,20.78,0.12,65.64,0.89,529.0,1273.0,10.0,59.0,53.0,1030.0,1802.0,160.0,60945.67,66241.38,31.16,8.64,14.12,1.81,421,10889.0,8637.0,2252.0,21.0,308.0,39.0,253.0,2269.0,23.0,1742.0,10.0,53.0,407.0,1802.0,-1273.0,-490.0,38.0,499,177.0,8205.0,1030.0,2872.0,12284.0,2308.0,168.0,6220.0,3589.0,12284.0,27,Consumer Staples,Personal Products,2.4,Large Cap,DABUR,https://mkt.in/static/mkt-icons/nifty100/DABUR.png,Dabur India Ltd,https://in.tradingview.com/chart/?symbol=NSE%3ADABUR,Dabur India is one of the leading fast moving consumer goods (FMCG) players dealing in consumer care and food products.,http://www.dabur.com/,https://www.nseindia.com/get-quotes/equity?symbol=DABUR,https://www.bseindia.com/stock-share-price/dabur-india-ltd/DABUR/500096/,1.0,59.0,22.3,19.2,6.601431123318302,8.13637059268537,13.939467460627132,1.034443168771527,45.78815645227098,26
474,HEROMOTOCO,2024,9.9,86.15,21.14,0.03,47.27,1.44,3095.0,1828.0,187.0,951.0,75.0,606.0,4923.0,246.0,1593400.88,1475343.49,53.86,12.6,28.27,1.91,604,37789.0,76.0,32554.0,5235.0,14.0,689.0,757.0,5090.0,26.0,3742.0,187.0,75.0,572.0,4923.0,-1828.0,-2717.0,379.0,692,40.0,18971.0,588.0,9663.0,29261.0,6588.0,145.0,14980.0,7548.0,29261.0,41,Consumer Discretionary,Two Wheelers,0.26,Large Cap,HEROMOTOCO,https://mkt.in/static/mkt-icons/nifty100/HEROMOTOCO.png,Hero MotoCorp Ltd,https://in.tradingview.com/chart/?symbol=NSE%3AHEROMOTOCO,"Hero Moto Corp earlier also known as \""Hero Honda\"" is one of India's first motorcycle manufacturers.
The company started in 1984 as a Technological collaboration with Honda, Japan. Before this collaboration, Hero was selling Cycles under the brand name, Hero Cycles.",http://www.heromotocorp.com/,https://www.nseindia.com/get-quotes/equity?symbol=HEROMOTOCO,https://www.bseindia.com/stock-share-price/hero-motocorp-ltd/HEROMOTOCO/500182/,2.0,951.0,29.1,22.0,4.104001615840858,5.936862676941823,8.674914145052593,1.3156066274719402,40.928325043809885,27
