id_x,company_id,year,net_profit_margin_pct,operating_profit_margin_pct,return_on_equity_pct,debt_to_equity,interest_coverage,asset_turnover,free_cash_flow_cr,capex_cr,earnings_per_share,book_value_per_share,dividend_payout_ratio_pct,total_debt_cr,cash_from_operations_cr,id_market,market_cap_crore,enterprise_value_crore,pe_ratio,pb_ratio,ev_ebitda,dividend_yield_pct,id_pl,sales,expenses,operating_profit,opm_percentage,other_income,interest,depreciation,profit_before_tax,tax_percentage,net_profit,eps,dividend_payout,id_cf,operating_activity,investing_activity,financing_activity,net_cash_flow,id_bs,equity_capital,reserves,borrowings,other_liabilities,total_liabilities,fixed_assets,cwip,investments,other_asset,total_assets,id_y,broad_sector,sub_sector,index_weight_pct,market_cap_category,id,company_logo,company_name,chart_link,about_company,website,nse_profile,bse_profile,face_value,book_value,roce_percentage,roe_percentage,revenue_cagr,pat_cagr,free_cash_flow_cagr,cfo_pat_ratio,composite_score,rank
580,IRCTC,2024,26.02,34.33,34.4,0.02,82.74,0.7,667.0,215.0,14.0,44.0,47.0,60.0,882.0,306.0,1258520.29,1473943.68,60.44,5.74,32.47,1.08,745,4270.0,2804.0,1466.0,34.0,106.0,19.0,57.0,1496.0,26.0,1111.0,14.0,47.0,690.0,882.0,-215.0,-404.0,262.0,818,160.0,3363.0,42.0,3234.0,6800.0,314.0,466.0,15.0,6005.0,6800.0,51,Consumer Discretionary,Travel & Tourism,3.97,Mid Cap,IRCTC,https://mkt.in/static/mkt-icons/nifty100/IRCTC.png,Indian Railway Catering & Tourism Corporation Ltd,https://in.tradingview.com/chart/?symbol=NSE%3AIRCTC,"Incorporated in 1999, IRCTC is a Mini Ratna (Category 1, Central Public Sector Enterprises ) and the only company authorized by the Indian government to provide online railway tickets, catering services, and packaged drinking water
at railway stations and trains in India",http://www.irctc.com/,https://www.nseindia.com/get-quotes/equity?symbol=IRCTC,https://www.bseindia.com/stock-share-price/indian-railway-catering-tourism-corporation-ltd/IRCTC/542830/,2.0,44.0,53.8,40.4,16.75656887152892,26.81198686210522,45.37464474156747,0.7938793879387939,87.72072535553819,1
12,ABB,2024,20.53,24.84,32.47,0.02,141.75,1.13,797.0,416.0,565.0,1657.0,73.0,83.0,1213.0,6.0,1536236.24,1619349.16,75.58,4.48,12.63,0.96,72,5849.0,4396.0,1453.0,25.0,248.0,12.0,71.0,1618.0,26.0,1201.0,565.0,73.0,83.0,6038.0,-4943.0,-543.0,551.0,148,21.0,3500.0,60.0,1481.0,5063.0,216.0,13.0,0.0,4834.0,5063.0,1,Industrials,Capital Goods,0.81,Large Cap,ABB,https://mkt.in/static/mkt-icons/nifty100/ABB.png,Abbott India Ltd,https://in.tradingview.com/chart/?symbol=NSE%3AABBOTINDIA,Abbott India Ltd is one of the leading multinational pharmaceutical companies in India and sells its products through independent distributors primarily within India.,https://www.abbott.co.in/,https://www.nseindia.com/get-quotes/equity?symbol=ABBOTINDIA,https://www.bseindia.com/stock-share-price/abbott-india-ltd/ABBOTINDIA/500488/,10.0,1657.0,46.0,34.9,12.1738707400457,21.191023990902647,30.677501093386518,5.027477102414655,85.46733678680873,2
1055,INDIGO,2024,11.85,76.3,892.57,0.02,22.61,56.39,9424.0,11759.0,212.0,97.0,0.0,17.0,21183.0,282.0,1040632.92,1061542.29,76.23,7.87,24.64,4.27,1373,68904.0,4805.0,52573.0,16331.0,24.0,2326.0,6406.0,8043.0,-2.0,8167.0,212.0,0.0,644.0,21183.0,-11759.0,-9979.0,-555.0,769,48.0,905.0,20.0,266.0,1239.0,570.0,64.0,178.0,427.0,1239.0,47,Consumer Discretionary,Airlines,3.03,Large Cap,INDIGO,https://rb.gy/rv6gr8,Interglobe Aviation Ltd,https://in.tradingview.com/chart/?symbol=NSE%3AINDIGO,"Interglobe Aviation Ltd (Indigo) is India's largest passenger airline operating as a low-cost carrier. Serving 86 destinations including 24 international destinations, it provides passengers with a simple, unbundled product, fulfilling its singular brand promise of providing \""low fares, on-time flights, and a courteous and hassle-free service\"" to its customers. IndiGo commenced operations in August 2006 with a single aircraft and has grown its fleet to 262 aircrafts.",http://www.goindigo.in/,https://www.nseindia.com/get-quotes/equity?symbol=INDIGO,https://www.bseindia.com/stock-share-price/interglobe-aviation-ltd/INDIGO/539448/,10.0,97.0,24.5,,20.083457250362848,23.700547063638933,,2.5937308681278317,72.2209720896724,3
415,HAL,2023,21.58,24.77,3283.05,0.27,130.33,99.37,3102.0,5734.0,87.0,465.0,32.0,47.0,8836.0,215.0,2122373.86,2704291.55,11.8,2.43,27.48,3.62,539,26928.0,20258.0,6669.0,25.0,1672.0,64.0,1784.0,6493.0,10.0,5811.0,87.0,32.0,512.0,8836.0,-5734.0,-1731.0,1370.0,614,5.0,172.0,47.0,47.0,271.0,57.0,23.0,35.0,156.0,271.0,36,Industrials,Defence & Aerospace,1.6,Large Cap,HAL,https://mkt.in/static/mkt-icons/nifty100/HAL.png,Hindustan Aeronautics Ltd,https://in.tradingview.com/chart/qGsydD2w/?symbol=NSE%3AAMBUJACEM.T0,"Hindustan Aeronautics is engaged in the business of Manufacture of Aircraft and Helicopters and Repair, Maintenance of Aircraft and Helicopters",https://hal-india.co.in/,https://www.nseindia.com/get-quotes/equity?symbol=HAL,https://www.bseindia.com/stock-share-price/hindustan-aeronautics-ltd/HAL/541154/,5.0,465.0,38.9,28.9,7.720282781323262,18.165728505247316,,1.5205644467389434,69.82324886224146,4
983,TCS,2024,19.14,26.69,50.94,0.09,87.1,1.66,38247.0,6091.0,127.0,281.0,58.0,8021.0,44338.0,522.0,461188.15,542230.13,78.69,6.08,29.94,1.62,1196,240893.0,176597.0,64296.0,27.0,3464.0,778.0,4985.0,61997.0,26.0,46099.0,127.0,58.0,1109.0,44338.0,6091.0,-48536.0,1893.0,1426,362.0,101133.0,9046.0,50583.0,161124.0,20729.0,1500.0,36081.0,102814.0,161124.0,87,Information Technology,IT Services,1.1,Large Cap,TCS,https://images.5paisa.com/MarketIcons/TCS.png,Tata Consultancy Services Ltd,https://www.tradingview.com/chart/?symbol=NSE%3ATCS,"Tata Consultancy Services is the flagship company and a part of Tata group. It is an IT services, consulting and business solutions organization that has been partnering with many of the world's largest businesses in their transformation journeys for over 50 years. TCS offers a consulting-led, cognitive powered, integrated portfolio of business, technology and engineering services and solutions.",https://www.tcs.com/,https://www.nseindia.com/get-quotes/equity?symbol=TCS,https://www.bseindia.com/stock-share-price/tata-consultancy-services-ltd/TCS/532540/,1.0,281.0,64.3,0.52,12.969173527526845,11.387761678665665,19.12910655392772,0.9617996051975097,69.57341904227393,5
694,LTIM,2022,15.13,20.1,27.65,0.02,48.9,1.27,1608.0,1643.0,225.0,711.0,41.0,258.0,3251.0,370.0,1202160.21,1208511.88,45.11,12.85,11.47,0.47,870,26109.0,20860.0,5249.0,20.0,766.0,123.0,597.0,5294.0,25.0,3950.0,225.0,41.0,807.0,3251.0,-1643.0,-1680.0,-73.0,958,30.0,14258.0,258.0,6027.0,20572.0,3473.0,503.0,6048.0,10548.0,20572.0,62,Information Technology,IT Services,2.64,Large Cap,LTIM,,LTIMindtree Ltd,https://mkt.in/static/mkt-icons/nifty100/ABB.png,"LTIMindtree Limited is an Indian multinational information technology services and consulting company based in Mumbai. A subsidiary of Larsen & Toubro, the company was incorporated in 1996 and employs more than 81,000 people",https://www.ltimindtree.com/,https://www.nseindia.com/get-quotes/equity?symbol=LTIM,https://www.bseindia.com/stock-share-price/ltimindtree-ltd/ltim/540005/,1.0,711.0,34.1,26.04,22.38122500495996,21.02441783355038,14.796205839600551,0.8230379746835443,68.41494427077423,6
985,TECHM,2014,16.29,22.19,33.35,0.04,55.2,1.18,1305.0,291.0,32.0,270.0,15.0,363.0,1596.0,,,,,,,,1199,18802.0,14630.0,4172.0,22.0,244.0,80.0,522.0,3815.0,20.0,3062.0,32.0,15.0,1111.0,1596.0,291.0,-972.0,915.0,1441,234.0,8948.0,363.0,6394.0,15940.0,2594.0,266.0,1472.0,11607.0,15940.0,88,Information Technology,IT Services,2.39,Large Cap,TECHM,https://mkt.in/static/mkt-icons/nifty100/TECHM.png,Tech Mahindra Ltd,https://in.tradingview.com/chart/qGsydD2w/?symbol=NSE%3AAMBUJACEM.T0,"Tech Mahindra Ltd provides comprehensive range of IT services, including IT enabled service, application development and",https://www.techmahindra.com/,https://www.nseindia.com/get-quotes/equity?symbol=TECHM,https://www.bseindia.com/stock-share-price/tech-mahindra-ltd/TECHM/532755/,5.0,270.0,11.9,8.63,20.196841001530764,5.668311519254132,32.28517405641733,0.5212279555845852,65.92185203509267,7
371,EICHERMOT,2024,24.2,26.18,22.17,0.02,114.71,0.72,890.0,2834.0,146.0,693.0,35.0,419.0,3724.0,192.0,222391.83,234358.89,15.62,13.61,19.29,4.41,488,16536.0,12206.0,4329.0,26.0,1521.0,51.0,598.0,5202.0,23.0,4001.0,146.0,35.0,469.0,3724.0,-2834.0,-844.0,45.0,567,27.0,18952.0,404.0,4997.0,24380.0,3490.0,230.0,14693.0,5968.0,24380.0,32,Consumer Discretionary,Two Wheelers,3.13,Large Cap,EICHERMOT,https://mkt.in/static/mkt-icons/nifty100/EICHERMOT.png,Eicher Motors Ltd,https://in.tradingview.com/chart/qGsydD2w/?symbol=NSE%3AAMBUJACEM.T0,"Eicher Motors Limited, incorporated in 1982, is the listed company of the Eicher Group in India and a leading player in the Indian automobile industry and the global leader in middleweight motorcycles.
Eicher has a joint venture with Sweden's AB Volvo to create Volvo Eicher Commercial Vehicles Limited (VECV). VECV is engaged in truck and bus operations, auto components business, and technical",https://www.eicher.in/,https://www.nseindia.com/get-quotes/equity?symbol=EICHERMOT,https://www.bseindia.com/stock-share-price/eicher-motors-ltd/EICHERMOT/505200/,1.0,693.0,31.1,24.2,9.02825344217768,21.3763534266848,,0.9307673081729567,63.410146596695505,8
102,ASIANPAINT,2024,15.66,21.37,29.68,0.13,41.0,1.19,3556.0,2548.0,57.0,188.0,58.0,2474.0,6104.0,54.0,2126725.18,2475080.63,73.37,3.9,23.94,2.42,196,35495.0,27910.0,7585.0,21.0,821.0,205.0,853.0,7348.0,24.0,5558.0,57.0,58.0,174.0,6104.0,-2548.0,-2982.0,573.0,278,96.0,17928.0,2516.0,8934.0,29474.0,7879.0,2272.0,3695.0,15629.0,29474.0,9,Materials,Paints & Coatings,1.13,Large Cap,ASIANPAINT,https://mkt.in/static/mkt-icons/nifty100/ASIANPAINT.png,"Asian Paints
Indian Multi-National Paint and Coating Manufacturing Company",https://in.tradingview.com/chart/?symbol=NSE%3AASIANPAINT,"Asian Paints Ltd is an Indian multinational paint company, headquartered in Mumbai. The company is engaged in the business of manufacturing, selling and distribution of paints, coatings, products related to home decor, bath fittings and providing related services.",https://www.asianpaints.com/,https://www.nseindia.com/get-quotes/equity?symbol=ASIANPAINT,https://www.bseindia.com/stock-share-price/asian-paints-ltd/asianpaint/500820/,1.0,188.0,41.75,31.45,11.705320941335007,15.308162187698926,15.56823256217168,1.0982367758186398,62.81265826219569,9
439,HCLTECH,2024,14.29,22.02,23.01,0.08,46.46,1.11,15840.0,6608.0,58.0,254.0,90.0,5758.0,22448.0,228.0,412593.29,461362.25,63.63,5.44,31.21,1.99,566,109913.0,85715.0,24198.0,22.0,1495.0,553.0,4173.0,20967.0,25.0,15710.0,58.0,90.0,537.0,22448.0,-6608.0,-15464.0,376.0,642,543.0,68332.0,5791.0,25097.0,99763.0,34480.0,172.0,7642.0,57469.0,99763.0,38,Information Technology,IT Services,2.5,Large Cap,HCLTECH,https://mkt.in/static/mkt-icons/nifty100/HCLTECH.png,HCL Technologies Ltd,https://in.tradingview.com/chart/qGsydD2w/?symbol=NSE%3AAMBUJACEM.T0,"HCL Tech is a leading global IT services company, which is ranked amongst the top five Indian IT services companies in terms of revenues. Since its inception into the global landscape after its IPO in 1999, HCL Tech has focused on transformational outsourcing, and offers an integrated portfolio of services including software-led IT solutions, remote infrastructure management, engineering and R&D services and BPO. The company leverages its extensive global offshore infrastructure and network of offices in 46",https://www.hcltech.com/,https://www.nseindia.com/get-quotes/equity?symbol=HCLTECH,https://www.bseindia.com/stock-share-price/hcl-technologies-ltd/HCLTECH/532281/,2.0,254.0,29.6,23.3,15.694617451413517,14.545882358679417,22.212934647485973,1.428898790579249,62.783598406724145,10
604,ITC,2024,29.28,37.02,27.85,0.0,362.96,0.77,15616.0,1563.0,16.0,60.0,84.0,303.0,17179.0,318.0,332245.58,369131.93,47.85,3.24,17.19,4.26,771,70866.0,44634.0,26233.0,37.0,2804.0,80.0,1816.0,27140.0,24.0,20751.0,16.0,84.0,711.0,17179.0,1563.0,-18551.0,191.0,844,1251.0,74015.0,304.0,18501.0,94071.0,29492.0,1387.0,28409.0,34784.0,94071.0,53,Consumer Staples,Diversified FMCG,1.39,Large Cap,ITC,https://mkt.in/static/mkt-icons/nifty100/ITC.png,ITC Ltd,https://in.tradingview.com/chart/?symbol=ITC,"ITC Limited is an Indian conglomerate, headquartered in Kolkata. It has a presence across six business segments, namely FMCG, hotels, agribusiness, information technology, paper products, and packaging.",https://www.itcportal.com/,https://www.nseindia.com/get-quotes/equity?symbol=ITC,https://www.bseindia.com/stock-share-price/itc-ltd/itc/500875/,1.0,60.0,34.76,29.47,7.612806258058069,9.425931069584559,15.431774102380391,0.8278637174112091,62.38280357433424,11
738,NAUKRI,2018,50.71,22.17,24.5,0.0,124.0,0.38,104.0,149.0,42.0,3225.0,13.0,1.0,253.0,,,,,,,,918,988.0,769.0,219.0,22.0,401.0,5.0,30.0,585.0,14.0,501.0,42.0,13.0,851.0,253.0,-149.0,-75.0,29.0,902,122.0,1923.0,1.0,550.0,2596.0,88.0,0.0,1565.0,943.0,2596.0,66,Communication Services,Internet & Platforms,4.44,Large Cap,NAUKRI,https://assets-netstorage.groww.in/stock-assets/logos2/InfoEdgIndia_32670259917_18844.png,Info Edge (India) Ltd,https://in.tradingview.com/chart/?symbol=NSE%3ANAUKRI,"Info Edge is India's premier online classified company with a portfolio of brands. It owns various brands in different fields like naukri.com (online recruitment), 99acres.com (online real estate), jeevansathi.com (online matrimonial) as well as shiksha.com (online education information services). It also acts as an investor and has invested in many start-ups in the online space and is actively growing its investment portfolio.",http://www.infoedge.in/,https://www.nseindia.com/get-quotes/equity?symbol=NAUKRI,https://www.bseindia.com/stock-share-price/info-edge-india-ltd/NAUKRI/532777/,10.0,3225.0,3.65,2.44,16.515171117605696,20.571804647248214,,0.5049900199600799,62.25583939369694,12
558,INFY,2024,17.08,23.7,29.79,0.09,87.52,1.13,20117.0,5093.0,63.0,218.0,,8359.0,25210.0,294.0,1112279.92,1372029.68,35.99,8.97,36.7,4.1,721,153670.0,117245.0,36425.0,24.0,4711.0,470.0,4678.0,35988.0,27.0,26248.0,63.0,,668.0,25210.0,-5093.0,-17504.0,2613.0,794,2072.0,88391.0,8804.0,42603.0,141870.0,31917.0,505.0,17394.0,92054.0,141870.0,49,Information Technology,IT Services,3.37,Large Cap,INFY,https://images.5paisa.com/MarketIcons/INFY.png,Infosys Ltd,https://in.tradingview.com/chart/?symbol=NSE%3AINFY,"Infosys Ltd provides consulting, technology, outsourcing and next-generation digital services to enable clients to execute strategies for their digital transformation",http://www.infosys.com/,https://www.nseindia.com/get-quotes/equity?symbol=INFY,https://www.bseindia.com/stock-share-price/infosys-ltd/INFY/500209/,5.0,218.0,40.0,31.8,12.925778520018305,9.754152854304344,14.697791723983645,0.9604541298384639,61.79565044877409,13
113,BAJAJ-AUTO,2016,17.99,21.23,28.97,0.01,5987.0,1.31,3622.0,68.0,140.0,1109.0,39.0,118.0,3690.0,,,,,,,,209,22574.0,17781.0,4793.0,21.0,1194.0,1.0,307.0,5679.0,28.0,4061.0,140.0,39.0,223.0,3690.0,-68.0,-3384.0,238.0,302,289.0,13731.0,118.0,3102.0,17240.0,2026.0,52.0,11067.0,4095.0,17240.0,12,Consumer Discretionary,Two Wheelers,3.9,Large Cap,BAJAJ-AUTO,https://mkt.in/static/mkt-icons/nifty100/BAJAJ-AUTO.png,Bajaj Auto Ltd,https://in.tradingview.com/chart/qGsydD2w/?symbol=NSE%3AAMBUJACEM.T0,"Bajaj Auto, the flagship company of Bajaj Group, is a two-wheeler and three-wheeler manufacturing company that exports to 79 countries across several countries in Latin America, Southeast Asia, and many more. Its headquarter is in Pune, India.
It has acquired 48% of the KTM Brand which manufactures sports and super sports two-wheelers, which was 14% in 2007 when the company first acquired KTM. [1]",https://www.bajajauto.com/,https://www.nseindia.com/get-quotes/equity?symbol=BAJAJ-AUTO,https://www.bseindia.com/stock-share-price/bajaj-auto-ltd/BAJAJ-AUTO/532977/,10.0,1109.0,33.5,26.5,7.610103604680107,8.528488754088425,20.63103849143375,0.9086431913321842,61.70291088233239,14
916,SUNPHARMA,2017,24.85,31.99,21.41,0.27,26.78,0.52,2896.0,4186.0,29.0,288.0,12.0,9832.0,7082.0,,,,,,,,1124,31578.0,21476.0,10102.0,32.0,610.0,400.0,1265.0,9048.0,13.0,7846.0,29.0,12.0,1042.0,7082.0,-4186.0,-2285.0,611.0,1314,240.0,36400.0,9832.0,14624.0,61095.0,17675.0,2801.0,1192.0,39427.0,61095.0,82,Healthcare,Pharmaceuticals,0.3,Large Cap,SUNPHARMA,https://mkt.in/static/mkt-icons/nifty100/SUNPHARMA.png,Sun Pharmaceuticals Industries Ltd,https://in.tradingview.com/chart/qGsydD2w/?symbol=NSE%3AAMBUJACEM.T0,"Sun Pharmaceutical Industries Ltd is engaged in the business of manufacturing, developing and marketing a wide range of branded and generic formulations and Active Pharma Ingredients (APIs). The company and its subsidiaries has various manufacturing facilities spread across the world with trading and other incidental and related activities extending to global market.[1] It is the largest pharmaceutical company in India.[2]",https://sunpharma.com/,https://www.nseindia.com/get-quotes/equity?symbol=SUNPHARMA,https://www.bseindia.com/stock-share-price/sun-pharmaceuticals-industries-ltd/SUNPHARMA/524715/,1.0,288.0,17.3,16.7,14.316083130091606,9.705653293530192,24.940231338729358,0.9026255416772878,59.201984899474525,15
756,NESTLEIND,2024,16.12,23.83,117.75,0.1,41.19,2.32,2938.0,1237.0,41.0,41.0,79.0,345.0,4175.0,402.0,1677775.19,1677279.88,54.96,14.34,15.49,3.85,937,24394.0,18581.0,5813.0,24.0,159.0,145.0,538.0,5289.0,26.0,3933.0,41.0,79.0,869.0,4175.0,-1237.0,-3135.0,-198.0,896,96.0,3894.0,370.0,6747.0,11108.0,3925.0,2340.0,786.0,4057.0,11108.0,67,Consumer Staples,Food Products,0.94,Large Cap,NESTLEIND,https://mkt.in/static/mkt-icons/nifty100/NESTLEIND.png,Nestle India Ltd,https://in.tradingview.com/chart/?symbol=NSE%3ANESTLEIND,"Nestle India Limited is the Indian subsidiary of Nestle which is a Swiss multinational company. The company is headquartered in Gurgaon, Haryana. The company's products include food, beverages, chocolate, and confectioneries.",https://www.nestle.in/,https://www.nseindia.com/get-quotes/equity?symbol=NESTLEIND,https://www.bseindia.com/stock-share-price/nestle-india-ltd/nestleind/500790/,1.0,41.0,185.43,135.61,9.377179141984705,12.123679940401999,7.289119583372683,1.0615306381896772,58.70669705300885,16
320,DIVISLAB,2021,28.47,41.14,21.34,0.0,1462.0,0.65,1872.0,75.0,75.0,517.0,27.0,5.0,1947.0,165.0,1595539.83,1586504.61,9.75,6.26,21.89,0.76,433,6969.0,4102.0,2867.0,41.0,57.0,2.0,256.0,2666.0,26.0,1984.0,75.0,27.0,418.0,1947.0,75.0,-35.0,1987.0,511,53.0,9242.0,5.0,1471.0,10771.0,3704.0,711.0,0.0,6356.0,10771.0,28,Healthcare,Pharmaceuticals,3.75,Large Cap,DIVISLAB,https://mkt.in/static/mkt-icons/nifty100/DIVISLAB.png,Divis Laboratories Ltd,https://in.tradingview.com/chart/qGsydD2w/?symbol=NSE%3AAMBUJACEM.T0,"Incorporated in 1990, Divis Laboratories Ltd manufactures and exports API's, Intermediates and Nutraceutical ingredients",https://www.divislaboratories.com/lander,https://www.nseindia.com/get-quotes/equity?symbol=DIVISLAB,https://www.bseindia.com/stock-share-price/divis-laboratories-ltd/DIVISLAB/532488/,2.0,517.0,16.5,12.2,12.511490330230668,9.293175538754372,14.439348744084079,0.9813508064516129,56.94036306847336,17
390,GODREJCP,2019,22.71,20.67,32.23,0.47,10.48,0.73,1455.0,274.0,23.0,119.0,44.0,3382.0,1729.0,199.0,807328.65,896565.06,26.5,4.95,21.35,4.17,509,10314.0,8183.0,2132.0,21.0,362.0,238.0,170.0,2085.0,-12.0,2342.0,23.0,44.0,488.0,1729.0,274.0,-2039.0,-36.0,587,102.0,7165.0,3382.0,3445.0,14094.0,8670.0,52.0,516.0,4855.0,14094.0,34,Consumer Staples,Personal Products,0.89,Large Cap,GODREJCP,https://mkt.in/static/mkt-icons/nifty100/GODREJCP.png,Godrej Consumer Products Ltd,https://in.tradingview.com/chart/?symbol=NSE%3AGODREJCP,"Godrej Consumer Products Limited is an Indian Multinational consumer goods company based in Mumbai, India. GCPL's products include soap, hair colourants, toiletries and liquid detergents.",https://www.godrejcp.com/,https://www.nseindia.com/get-quotes/equity?symbol=GODREJCP,https://www.bseindia.com/stock-share-price/godrej-consumer-products-ltd/godrejcp/532424/,1.0,119.0,26.49,6.77,7.423727060784069,,,0.7382578992314262,56.745988760077914,18
299,COALINDIA,2024,26.26,66.29,45.17,0.08,11.24,0.6,13617.0,4486.0,61.0,156.0,42.0,6523.0,18103.0,156.0,454024.84,574785.39,34.27,14.75,25.15,4.38,410,142324.0,819.0,94352.0,47971.0,34.0,8396.0,6735.0,48813.0,23.0,37369.0,61.0,42.0,397.0,18103.0,-4486.0,-13899.0,-282.0,489,6163.0,90034.0,7816.0,145345.0,249359.0,83642.0,16129.0,9058.0,140529.0,249359.0,26,Materials,Mining & Metals,2.46,Large Cap,COALINDIA,https://mkt.in/static/mkt-icons/nifty100/COALINDIA.png,Coal India Ltd,https://in.tradingview.com/chart/?symbol=NSE%3ACOALINDIA,"Coal India Ltd is mainly engaged in mining and production of Coal and also operates Coal washeries. The major consumers of the company are power and steel sectors. Consumers from other sectors include cement, fertilizers, brick kilns etc.",http://www.coalindia.in/,https://www.nseindia.com/get-quotes/equity?symbol=COALINDIA,https://www.bseindia.com/stock-share-price/coal-india-ltd/COALINDIA/533278/,10.0,156.0,63.6,52.0,6.901870831390378,7.220628498640447,5.863057152249307,0.48443897348069254,56.09389257260395,19
457,HDFCLIFE,2018,3.43,96.67,23.53,0.0,110.6,0.29,2318.0,4421.0,6.0,73.0,25.0,0.0,6739.0,,,,,,,,586,32260.0,11.0,31186.0,1074.0,3.0,282.0,44.0,1300.0,15.0,1107.0,6.0,25.0,555.0,6739.0,-4421.0,-196.0,2122.0,673,2012.0,2693.0,0.0,105778.0,110483.0,336.0,5.0,106590.0,3551.0,110483.0,40,Financials,Life Insurance,0.93,Large Cap,HDFCLIFE,https://mkt.in/static/mkt-icons/nifty100/HDFCLIFE.png,HDFC Life Insurance Company Ltd,https://in.tradingview.com/chart/?symbol=NSE%3AHDFCLIFE,HDFC Life Insurance Company is engaged in carrying on the business of life insurance. The Company offers a range of individual and group insurance solutions.,http://www.hdfclife.com/,https://www.nseindia.com/get-quotes/equity?symbol=HDFCLIFE,https://www.bseindia.com/stock-share-price/hdfc-life-insurance-company-ltd/HDFCLIFE/540777/,10.0,73.0,6.61,11.4,19.68416652339917,12.124300302065084,,6.087624209575429,55.500686069164544,20
816,PIDILITIND,2024,14.11,21.87,20.78,0.05,54.33,1.03,955.0,1769.0,34.0,171.0,47.0,382.0,2724.0,432.0,162274.18,165749.2,36.12,12.3,5.36,1.01,1002,12383.0,9675.0,2708.0,22.0,63.0,51.0,341.0,2379.0,27.0,1747.0,34.0,47.0,929.0,2724.0,-1769.0,-742.0,212.0,1074,51.0,8664.0,379.0,3662.0,12755.0,5499.0,161.0,2546.0,4550.0,12755.0,72,Materials,Specialty Chemicals,2.15,Large Cap,PIDILITIND,https://mkt.in/static/mkt-icons/nifty100/PIDILITIND.png,Pidilite Industries Ltd,https://in.tradingview.com/chart/?symbol=NSE%3APIDILITIND,"Pidilite Industries Limited is a leading manufacturer of adhesives and sealants, construction chemicals, craftsmen products, DIY products and polymer emulsions in India. Most of the products have been developed through strong in-house R&D. Our brand name Fevicol has become synonymous with adhesives to millions in India and is ranked amongst the most trusted brands in the country",http://www.pidilite.com/,https://www.nseindia.com/get-quotes/equity?symbol=PIDILITIND,https://www.bseindia.com/stock-share-price/pidilite-industries-ltd/PIDILITIND/500331/,1.0,171.0,29.7,22.8,11.667953979534062,13.737180731636279,10.203044708356757,1.559244419004007,52.30184291743175,21
350,DRREDDY,2015,15.55,23.35,23.71,0.44,34.89,0.81,154.0,2370.0,27.0,369.0,15.0,4314.0,2524.0,,,,,,,,466,15023.0,11515.0,3508.0,23.0,260.0,108.0,760.0,2900.0,19.0,2336.0,27.0,15.0,448.0,2524.0,-2370.0,-433.0,-280.0,544,85.0,9768.0,4314.0,4290.0,18457.0,5377.0,529.0,2248.0,10303.0,18457.0,31,Healthcare,Pharmaceuticals,1.01,Mid Cap,DRREDDY,https://mkt.in/static/mkt-icons/nifty100/DRREDDY.png,Dr Reddys Laboratories Ltd,https://in.tradingview.com/chart/qGsydD2w/?symbol=NSE%3AAMBUJACEM.T0,"Dr. Reddy's Laboratories Ltd is a leading India-based pharmaceutical company which offers a portfolio of products and services, including Active Pharmaceutical Ingredients (APIs), Custom Pharmaceutical services (CPS), generics, biosimilars and differentiated formulations.",https://www.drreddys.com/,https://www.nseindia.com/get-quotes/equity?symbol=DRREDDY,https://www.bseindia.com/stock-share-price/dr-reddys-laboratories-ltd/DRREDDY/500124/,1.0,369.0,26.5,21.4,8.148686685959095,12.4990986817211,,1.0804794520547945,51.32566797820554,22
